{
  "schema_version": "1.0",
  "kind": "editorial_gate",
  "status": "pass",
  "editorial_plan_sha256": "f3fa934f160eba7ffcc18f73257bc1d3668ce53aeb819e4aee99d27aad62249f",
  "coverage_matrix_sha256": "9319674e606fb45154917494eec30de0eeed2cea994e7e1156a115945e01806f",
  "knowledge_graph_sha256": "ea0808e1e69950caf19e36b178480a2361008086c3b94592b8c2dfdd8e605751",
  "knowledge_gate_sha256": "d2183d0b16f3c352cfd3453eeba1d6f96192b779eb5bfa52093dbbee5f2a6286",
  "checks": [
    {
      "name": "approved_page_plan_identity",
      "status": "pass",
      "details": {
        "plan": "08af079cf8ea64e014bf69867a43b5907b4c4584ff5c306d627267a51d93b46c",
        "approval": "d52b8959476dc41956e580571d63225c751da4383e9a7e08f2cfce89ecd95b8d"
      }
    },
    {
      "name": "complete_primary_disposition",
      "status": "pass",
      "details": {
        "details": 69,
        "appendix_details": 0,
        "images": 17
      }
    }
  ],
  "human_review_required": false,
  "human_review": {
    "status": "pass",
    "reviewed_on": "2026-10-06",
    "scope": "用户确认当前规划；内容映射与版本完整，不代表成图或视觉验收。"
  }
}
